### ISSUE TITLE
Elusive problem in ktcp

### ISSUE THREAD

**Issue by Mellvik** [Mellvik/TLVC#9]
Under high load, `ktcp` may fail to open new connections and eventually hang completely. The issue is very timing sensitive. even the smallest `printf` in related code eliminates the problem. Even rearranging some code in the `ktcp.c` main loop is enough to change the behaviour (but not to eliminate the problem).

Here's the scenario most likely to repeat the problem (this is on a AMI386SX/40 SBC):
- `telnet` into TLVC, issue the command `hd /dev/hda` - which will run for a long time.
- Wait for a couple of minutes, then connect to the TLVC system with `ftp`. A message should say `connect <something>`, then the `ftp` client would hang. The output in the `telnet` window will continue. If the client `ftp` command does not hang, `ktcp` is working normally and will continue to do so for a while. Try again in a few minutes, run some other commands in the meanwhile. And make sure there aren't any debug statements in the code that emit output during the opening of connections.
- If the `ftp` command hangs, issue a `netstat` command from the console or a serial terminal window. This will hang and the output in the `telnet` window will stop. Interrupt the hanging `netstat` with ^C and the output in the `telnet` window will continue. This stop/start sequence is repeatable any number of times.
- Aborting the hung `ftp` connection from the client is likely to hang `ktcp` completely (and make all network processes uninterruptible, including `netstat`).
- This is not the only way to trigger the behaviour, a second `telnet` session may have the same effect (or not), this part is unpredictable.

The `ftp` startup sequence that hangs gets through the first few packets, then stops:
```
    10.0.2.2.34938 > 10.0.2.17.ftp: Flags [S], cksum 0x1841 (incorrect -> 0xd3e1), seq 1108791349, win 29200, options [mss 1460,sackOK,TS val 2374025631 ecr 0,nop,wscale 7], length 0
12:48:23.230917 00:80:29:ef:d9:51 (oui Unknown) > b8:27:eb:9a:77:bc (oui Unknown), ethertype IPv4 (0x0800), length 64: (tos 0x0, ttl 64, id 558, offset 0, flags [none], proto TCP (6), length 44)
    10.0.2.17.ftp > 10.0.2.2.34938: Flags [S.], cksum 0x2338 (correct), seq 1057845702, ack 1108791350, win 4380, options [mss 1460], length 0
12:48:23.231067 b8:27:eb:9a:77:bc (oui Unknown) > 00:80:29:ef:d9:51 (oui Unknown), ethertype IPv4 (0x0800), length 54: (tos 0x0, ttl 64, id 55864, offset 0, flags [DF], proto TCP (6), length 40)
    10.0.2.2.34938 > 10.0.2.17.ftp: Flags [.], cksum 0x182d (incorrect -> 0xda00), seq 1, ack 1, win 29200, length 0
12:48:23.235371 00:80:29:ef:d9:51 (oui Unknown) > b8:27:eb:9a:77:bc (oui Unknown), ethertype IPv4 (0x0800), length 282: (tos 0x0, ttl 64, id 559, offset 0, flags [none], proto TCP (6), length 268)
```

IOW, `ktcp` accepts the connection by responding with a SYN-ACK, and the client follows with an ACK as appropriate, and it seems like this ACK is never registered on the TLVC side of the connection.

A lot of time has been spent on tracking down the problem, with little success so far. It seems likely though that the problem is located in the `tcpdev` code

**Comment by rafael2k** [comment]
I'm hitting some weird problem in ELKS. It might be related: https://github.com/ghaerr/elks/issues/2266

**Comment by Mellvik** [comment]
Hi Rafael, thanks for testing - and reporting. 
It would be helpful with a description of how to recreate the problem on TLVC.

I've had a major revision of ktcp in the works (and running locally) for quite some time, now nearing completion. Being able to check out this issue would be very useful.

**Comment by rafael2k** [comment]
Thanks @Mellvik. It is my first time compiling TLVC, and I'm having a small issue (https://github.com/Mellvik/TLVC/issues/156), but hopefully soon I'll be testing TLVC on this issue I'm facing on ELKS.

**Comment by rafael2k** [comment]
@Mellvik, do you think jnos IP stack could be of some use in ktcp?
Ex: https://github.com/Rhizomatica/jnos2/blob/main/ip.c

**Comment by Mellvik** [comment]
@rafael2k - thanks for the link. It's the first time I've looked closer at the jnos code. An impressive hybrid - both OS and application. And tons of functionality - allowed by the assumption that there is plenty memory available.

`Ktcp` is always making the opposite assumption. Don't waste memory, avoid functionality not strictly required, be smart about buffers, focus on fast code. IOW, keep things simple - it's supposed to run well on 4.7MHz 8088 systems too. 

While far from perfect, `ktcp` does a decent job given the circumstances (check out the recently added chapter on network implementation in the Networking Guide Wiki  https://github.com/Mellvik/TLVC/wiki/TLVC-Networking-Guide). We're continuing (thanks for testing) to work the bugs out, and my upcoming version has a number of improvements, in particular in handling slow connections. Ironically, the current `ktcp` works quite well when connecting to/from 'big' (ie. fast) systems, but not when talking to 'itself' as in another ktcp based system. There is a detailed Wiki article pending about that too.

Back to JNOS: What I was thinking when looking at it, was to take a close look at the udp implementation, which is missing in ktcp.

Thanks.

**Comment by ghaerr** [comment]
> do you think jnos IP stack could be of some use in ktcp

> An impressive hybrid - both OS and application

JNOS is a variant/fork of Phil Karn's DOS KA9Q TCP from 40 years ago. Karn wrote a very complete implementation that was used extensively for packet radio enthusiasts, and I can see the AX25 support is still being enhanced in JNOS. 

Inherent in the design is that each application (telnet, etc) is linked directly with the TCP stack, which worked well for single-tasking DOS. It appears that JNOS extended this to an "OS" which is implemented in kernel.c, which uses a small group of stack-switching routines that allow all of the applications to be linked together, and then the stack switching code allows for each of the services to be used individually or together at the same time.

This approach won't work well on ELKS since the kernel does its own multitasking and our applications use BSD sockets to communicate with TCP. ELKS TCP is further complicated with the (unfortunate?) design of having TCP implemented outside the kernel in the ktcp userland process. This complicates many interactions, especially those where blocking may or may not occur.

One very cool thing JNOS (and possibly KA9Q?) does is support the NIC Packet Driver spec. This allows any of a whole bunch of already tested-and-working binary NIC drivers to be easily used. It appears that JNOS doesn't actually load the packet driver, but all of the code showing how to interface and redirect interrupts is available. I'd always thought it'd be nice if ELKS supported packet drivers, but since some execute various DOS INT 21h functions at init time, making all this work is probably not worth the effort.

Moving our TCP back into the kernel would also be interesting, but probably not worth the effort, especially after all the work @Mellvik and I have done to get the current version working as well as it is today.
